Google,"Google Pays Apple $15,000 For Hacking Chrome Security",https://news.google.com/articles/CBMiaGh0dHBzOi8vd3d3LmZvcmJlcy5jb20vc2l0ZXMvZGF2ZXl3aW5kZXIvMjAyMy8wOC8wMy9nb29nbGUtcGF5cy1hcHBsZS0xNTAwMC1mb3ItaGFja2luZy1jaHJvbWUtc2VjdXJpdHkv0gFsaHR0cHM6Ly93d3cuZm9yYmVzLmNvbS9zaXRlcy9kYXZleXdpbmRlci8yMDIzLzA4LzAzL2dvb2dsZS1wYXlzLWFwcGxlLTE1MDAwLWZvci1oYWNraW5nLWNocm9tZS1zZWN1cml0eS9hbXAv?hl=en-US&gl=US&ceid=US%3Aen,2023-08-03T10:50:47Z,True
Google,"Google Pays Apple $15,000 For Hacking Chrome Security",https://news.google.com/articles/CBMiaGh0dHBzOi8vd3d3LmZvcmJlcy5jb20vc2l0ZXMvZGF2ZXl3aW5kZXIvMjAyMy8wOC8wMy9nb29nbGUtcGF5cy1hcHBsZS0xNTAwMC1mb3ItaGFja2luZy1jaHJvbWUtc2VjdXJpdHkv0gFsaHR0cHM6Ly93d3cuZm9yYmVzLmNvbS9zaXRlcy9kYXZleXdpbmRlci8yMDIzLzA4LzAzL2dvb2dsZS1wYXlzLWFwcGxlLTE1MDAwLWZvci1oYWNraW5nLWNocm9tZS1zZWN1cml0eS9hbXAv?hl=en-US&gl=US&ceid=US%3Aen,2023-08-03T10:50:47Z,True
Google,"Google Pays Apple $15,000 For Hacking Chrome Security",https://news.google.com/articles/CBMiaGh0dHBzOi8vd3d3LmZvcmJlcy5jb20vc2l0ZXMvZGF2ZXl3aW5kZXIvMjAyMy8wOC8wMy9nb29nbGUtcGF5cy1hcHBsZS0xNTAwMC1mb3ItaGFja2luZy1jaHJvbWUtc2VjdXJpdHkv0gFsaHR0cHM6Ly93d3cuZm9yYmVzLmNvbS9zaXRlcy9kYXZleXdpbmRlci8yMDIzLzA4LzAzL2dvb2dsZS1wYXlzLWFwcGxlLTE1MDAwLWZvci1oYWNraW5nLWNocm9tZS1zZWN1cml0eS9hbXAv?hl=en-US&gl=US&ceid=US%3Aen,2023-08-03T10:50:47Z,True
Google,"Google Pays Apple $15,000 For Hacking Chrome Security",https://www.forbes.com/sites/daveywinder/2023/08/03/google-pays-apple-15000-for-hacking-chrome-security/?sh=64dfb284704c,2023-08-03T10:50:47Z,True
Google,Google Search Generative Experience AI-Generated Answers Gain ...,https://www.seroundtable.com/google-search-generative-experience-video-answers-35809.html,2023-08-03T11:41:00Z,False
Google,Rare discount brings Google’s new 2nd Gen Pixel Stand charger to your Pixel 7/Pro at $71,https://9to5toys.com/2023/08/03/discount-google-pixel-stand-2nd-gen-amazon/,2023-08-03T11:45:01Z,False
Google,Google Search Console Not Tracking Search Generative ...,https://www.seroundtable.com/google-search-console-not-tracking-search-generative-experience-35811.html,2023-08-03T11:31:00Z,False
Google,Google News expands language support by adding Gujarati and Punjabi for Indian users,https://www.indiatvnews.com/technology/news/google-news-platform-welcomes-gujarati-and-punjabi-languages-2023-08-03-884646,2023-08-03T11:46:51Z,False
Google,California varsity scientists foresee a blend of Google and ChatGPT within 2 years,https://www.bizzbuzz.news/technology/california-varsity-scientists-foresee-a-blend-of-google-and-chatgpt-within-2-years-1237435,2023-08-03T11:24:53Z,False
Google,Effortless File Sharing: Google’s Nearby Share Now Supports Full Folder Transfer,https://www.gizchina.com/2023/08/03/google-nearby-share-folder-transfer/,2023-08-03T11:32:29Z,False
Google,Google has announced a Chrome update to improve the browser's ...,https://mezha.media/en/2023/08/03/google-has-announced-a-chrome-update-to-improve-the-browser-s-performance/,2023-08-03T11:50:49Z,False
Google,"FCCPC Orders Google To Delist 18 Loan Apps, Stop Payment ...",https://thestreetjournal.org/fccpc-orders-google-to-delist-18-loan-apps-stop-payment-gateways/,2023-08-03T11:11:27Z,False
Google,Margin-based tracking: 3 advanced strategies for Google Shopping ...,https://searchengineland.com/margin-based-tracking-advanced-strategies-google-shopping-profitability-430162,2023-08-03T12:00:00Z,False
Google,Google Search Generative Experience AI-Generated Answers Gain ...,https://www.seroundtable.com/google-search-generative-experience-video-answers-35809.html,2023-08-03T11:41:00Z,False
Google,Google's Waymo to expand self-driving testing in Austin with rideshare,https://www.statesman.com/story/business/technology/2023/08/03/more-rideshare-from-selfdgoogle-subsidiary-waymo-to-expand-self-driving-rideshare-services-to-austin/70515125007/,2023-08-03T11:28:52Z,False
Google,Rare discount brings Google’s new 2nd Gen Pixel Stand charger to your Pixel 7/Pro at $71,https://9to5toys.com/2023/08/03/discount-google-pixel-stand-2nd-gen-amazon/,2023-08-03T11:45:01Z,False
Google,Google Search Console Not Tracking Search Generative ...,https://www.seroundtable.com/google-search-console-not-tracking-search-generative-experience-35811.html,2023-08-03T11:31:00Z,False
